;description;lien
322;"Al-Khansa était la poétesse arabe la plus célèbre du 7ème siècle et la poétesse la plus connue de la littérature arabe. Elle a passé la plus grande partie de sa vie au cours de la période préislamique, et lorsque l'Islam a prévalu, elle l'a embrassé et est allée voir le Messager d'Allah, paix et bénédictions d'Allah soient sur lui, en tant que membre de la délégation de sa tribu, Banu Sulaym. Le Prophète, paix et bénédictions d'Allah soient sur lui, lui avait demandé de réciter ses poésies en son honneur. Son nom complet est Tumadir bint ʿAmru Ibn al-Ḥarith Ibn al-Sharid al-Sulamiyyah, de la tribu de Banu Sulaym, de Qays Aylan, de Mudhar, de Najd.La plupart de ses poèmes, et les plus beaux, concernent ses frères Sakhr et Mu'awiyyah, tués à l'époque pré-islamique. Elle a pleuré leur mort en poésie et s'est fait connaître par ses compositions élégiaques. Son Diwan (recueil de poésie) contient ce qui a été mémorisé de sa poésie.Al-Khansa' avait quatre fils, qui se sont tous convertis à l'Islam et ont tous été tués dans la bataille d'Al-Qadisiyyah en 16 AH. Lorsqu'elle a reçu la nouvelle, elle n'a pas fait son deuil, mais a dit : ""Louange à Allah qui m'a honoré de leur martyre. Et j'ai bon espoir que mon Seigneur me réunira avec eux dans la demeure de Sa Miséricorde.""
";https://www.sifatusafwa.com/fr/diwan-poésie/diwan-al-khansa-les-œuvres-complètes.html#/147-edition-moyen_format_couverture_souple
323;"Al-Khansa était la poétesse arabe la plus célèbre du 7ème siècle et la poétesse la plus connue de la littérature arabe. Elle a passé la plus grande partie de sa vie au cours de la période préislamique, et lorsque l'Islam a prévalu, elle l'a embrassé et est allée voir le Messager d'Allah, paix et bénédictions d'Allah soient sur lui, en tant que membre de la délégation de sa tribu, Banu Sulaym. Le Prophète, paix et bénédictions d'Allah soient sur lui, lui avait demandé de réciter ses poésies en son honneur. Son nom complet est Tumadir bint ʿAmru Ibn al-Ḥarith Ibn al-Sharid al-Sulamiyyah, de la tribu de Banu Sulaym, de Qays Aylan, de Mudhar, de Najd.La plupart de ses poèmes, et les plus beaux, concernent ses frères Sakhr et Mu'awiyyah, tués à l'époque pré-islamique. Elle a pleuré leur mort en poésie et s'est fait connaître par ses compositions élégiaques. Son Diwan (recueil de poésie) contient ce qui a été mémorisé de sa poésie.Al-Khansa' avait quatre fils, qui se sont tous convertis à l'Islam et ont tous été tués dans la bataille d'Al-Qadisiyyah en 16 AH. Lorsqu'elle a reçu la nouvelle, elle n'a pas fait son deuil, mais a dit : ""Louange à Allah qui m'a honoré de leur martyre. Et j'ai bon espoir que mon Seigneur me réunira avec eux dans la demeure de Sa Miséricorde.""
";https://www.sifatusafwa.com/fr/diwan-poésie/diwan-al-khansa-les-œuvres-complètes.html#/150-edition-grand_format_couverture_rigide
324;"Diwan al-Mutanabi est l'un des meilleurs livres écrits par le meilleur des poètes arabes ""Abu al-Tayyib al-Mutanabbi"" ...Il avait une excellente maîtrise de la langue et une connaissance de ses origines et de ses règles. C'était une merveille qui donnait à penser aux gens que les jinns lui écrivaient de la poésie en sa compagnie...Son ""Diwan"" contient les plus belles louanges et les plus magnifiques poèmes jamais exprimés dans l'histoire de la poésie arabe.
";https://www.sifatusafwa.com/fr/diwan-poésie/diwan-al-mutanabbi-les-œuvres-complètes.html#/147-edition-moyen_format_couverture_souple
325;"Recueil de poèmes du célèbre Calife Haroun ar-Rachid. Cet ouvrage rassemble ses poèmes et les contextes historiques de ces derniers ainsi que leur signification.
Harakat en partie seulement et annotations expliquant les termes et expressions difficiles.Édité par Dar Sader, édition très sérieuse, notamment reconnue pour ses travaux sur les classiques arabes et les Diwans.
";https://www.sifatusafwa.com/fr/diwan-poésie/diwan-haroun-ar-rachid.html
326;"Recueil de poèmes du compagnon du Prophète, Ka'b ibn Malik al-Ansari, qui était considéré comme l'un des cinq plus grands poètes de Médine avant de devenir musulman.
Toutes les harakats sur les poèmes, et annotations expliquant les termes et expressions difficiles.Édité par Dar Sader, édition très sérieuse, notamment reconnue pour ses travaux sur les classiques arabes et les Diwans.
";https://www.sifatusafwa.com/fr/diwan-poésie/diwan-ka-b-ibn-malik-al-ansari.html
327;"Waddah al-Yaman est l'un des meilleurs poètes omeyyades et ce qui distingue sa poésie, c'est son esprit joyeux et irrévérencieux. Waddah est aujourd'hui considéré comme le poète national du Yémen.
Toutes les harakats sur les poèmes, et annotations expliquant les termes et expressions difficiles.
Édité par Dar Sader, édition très sérieuse, notamment reconnue pour ses travaux sur les classiques arabes et les Diwans.
";https://www.sifatusafwa.com/fr/diwan-poésie/diwan-waddah-al-yaman.html
328;"Très bon état : Livre en parfait état à l'exception d’un léger défaut tel que : tranche des pages tachée (traces de doigt ou légères taches d’humidité), défaut superficiel sur la couverture (- de 1cm), autocollant ou trace d’autocollant, quelques pages froissées.
Un livre en très bon état ne présente qu’un seul de ces dommages.
";https://www.sifatusafwa.com/fr/déstockage-et-occasion/UZ-abou-bakr-as-siddiq-abd-as-sattar-al-cheikh.html
329;"Bon état : Livre en bon état présentant un ou plusieurs défauts : tranche des pages tachée (traces de doigt ou légères taches d’humidité), défaut superficiel sur la couverture (- de 1cm), autocollant ou trace d’autocollant, quelques pages froissées, rayures ou déchirures de moins de 2cm sur un angle ou sur le derrière de la couverture, marque de froissement ou de pli due au transport, trace d’usure sous la tranche du livre (marque due à l’entreposage). 
Un livre en bon état ne présente qu’un ou deux de ces dommages.
 
Ce livre est neuf, mais il est endommagé. Vous pouvez trouver la fiche produit du livre neuf ici.
";https://www.sifatusafwa.com/fr/déstockage-et-occasion/al-iman-bi-al-qada-wa-al-qaar-muhammad-ibrahim-al-hamad.html
330;"Très bon état : Livre en parfait état à l'exception d’un léger défaut tel que : tranche des pages tachée (traces de doigt ou légères taches d’humidité), défaut superficiel sur la couverture (- de 1cm), autocollant ou trace d’autocollant, quelques pages froissées.
Un livre en très bon état ne présente qu’un seul de ces dommages.
";https://www.sifatusafwa.com/fr/déstockage-et-occasion/al-qawl-al-mufid-fi-adilat-at-tawhid-lecons-de-tawhid.html
331;" 
";https://www.sifatusafwa.com/fr/déstockage-et-occasion/as-siyam-question-réponse-waqf-min-majmu-ah-zad.html
332;"Acceptable : Livre abîmé de façon visible, mais dont l’aspect général reste bon et parfaitement lisible. Parmi les défauts possibles : larges rayures ou déchirures sur la couverture, traces d’humidité sur les pages, défaut sur la face de la couverture, la couverture peut être pliée ou désaxée sur un de ses côtés.
Un livre en état acceptable ne présente qu’un ou deux de ces dommages.
 
Ce livre est neuf, mais il est endommagé. Vous pouvez trouver la fiche produit du livre neuf ici.
 
";https://www.sifatusafwa.com/fr/déstockage-et-occasion/fath-al-quddus-as-salam-b-charh-nawaqid-al-islam-oubayd-al-jabiri.html
333;"Très bon état : Livre en parfait état à l'exception d’un léger défaut tel que : tranche des pages tachée (traces de doigt ou légères taches d’humidité), défaut superficiel sur la couverture (- de 1cm), autocollant ou trace d’autocollant, quelques pages froissées.
Un livre en très bon état ne présente qu’un seul de ces dommages.
";https://www.sifatusafwa.com/fr/déstockage-et-occasion/hidayah-al-murtab-poème-sur-les-yat-moutachabbih-as-sakhawi.html
334;"Bon état : Livre en bon état présentant un ou plusieurs défauts : tranche des pages tachée (traces de doigt ou légères taches d’humidité), défaut superficiel sur la couverture (- de 1cm), autocollant ou trace d’autocollant, quelques pages froissées, rayures ou déchirures de moins de 2cm sur un angle ou sur le derrière de la couverture, marque de froissement ou de pli due au transport, trace d’usure sous la tranche du livre (marque due à l’entreposage). 
Un livre en bon état ne présente qu’un ou deux de ces dommages.
 
Ce livre est neuf, mais il est endommagé. Vous pouvez trouver la fiche produit du livre neuf ici.
";https://www.sifatusafwa.com/fr/déstockage-et-occasion/makarim-al-akhlaq-fi-aw-al-quran-wa-as-sunnah-sa-di-al-chamri.html
335;"Edition saoudienne, couverture souple, 239 pages, sans les harakats.
";https://www.sifatusafwa.com/fr/déstockage-et-occasion/manhaj-as-salikin-wa-tawdih-al-fiqh-fi-ad-din-shaykh-as-sa-di.html
336;"Bon état : Livre en bon état présentant un ou plusieurs défauts : tranche des pages tachée (traces de doigt ou légères taches d’humidité), défaut superficiel sur la couverture (- de 1cm), autocollant ou trace d’autocollant, quelques pages froissées, rayures ou déchirures de moins de 2cm sur un angle ou sur le derrière de la couverture, marque de froissement ou de pli due au transport, trace d’usure sous la tranche du livre (marque due à l’entreposage). 
Un livre en bon état ne présente qu’un ou deux de ces dommages.
 
Ce livre est neuf, mais il est endommagé. Vous pouvez trouver la fiche produit du livre neuf ici.
";https://www.sifatusafwa.com/fr/déstockage-et-occasion/min-akhbar-as-salaf-as-salh.html
337;"Bon état : Livre en bon état présentant un ou plusieurs défauts : tranche des pages tachée (traces de doigt ou légères taches d’humidité), défaut superficiel sur la couverture (- de 1cm), autocollant ou trace d’autocollant, quelques pages froissées, rayures ou déchirures de moins de 2cm sur un angle ou sur le derrière de la couverture, marque de froissement ou de pli due au transport, trace d’usure sous la tranche du livre (marque due à l’entreposage). 
Un livre en bon état ne présente qu’un ou deux de ces dommages.
 
Ce livre est neuf, mais il est endommagé. Vous pouvez trouver la fiche produit du livre neuf ici.
";https://www.sifatusafwa.com/fr/déstockage-et-occasion/mouhadarat-fi-al-aqidah-wa-ad-da-ah-70-conférences-d-al-fawzan.html
338;"Biographie résumée du grand savant yéménite l'imam Muqbil al-Wadi'i.
";https://www.sifatusafwa.com/fr/déstockage-et-occasion/nubdha-yasira-min-hayat-al-allamah-al-wadi-iy-muhammad-sawmi-i.html
339;"Bon état : Livre en bon état présentant un ou plusieurs défauts : tranche des pages tachée (traces de doigt ou légères taches d’humidité), défaut superficiel sur la couverture (- de 1cm), autocollant ou trace d’autocollant, quelques pages froissées, rayures ou déchirures de moins de 2cm sur un angle ou sur le derrière de la couverture, marque de froissement ou de pli due au transport, trace d’usure sous la tranche du livre (marque due à l’entreposage). 
Un livre en bon état ne présente qu’un ou deux de ces dommages.
 
Ce livre est neuf, mais il est endommagé. Vous pouvez trouver la fiche produit du livre neuf ici.
";https://www.sifatusafwa.com/fr/déstockage-et-occasion/sufyan-ath-thawi-mohamed-matar-az-zahrani.html
340;" 
";https://www.sifatusafwa.com/fr/déstockage-et-occasion/wasl-al-qurraa-al-bararah-bi-isnad-al-qira-at-al-arba-abbas-awd-allah.html
341;"Comment éduquer ses enfants, conseils et recommandations réunis par le Cheikh Ahmad Tayyar. Vous trouverez dans cet ouvrage 30 règles afin de parvenir à l’excellence dans l’éducation et atteindre ses objectifs.
Ce livre est recommandé par le Cheikh Mouhammad ad-Douwaych.
";https://www.sifatusafwa.com/fr/education/comment-éduquer-ton-enfant-dr-ahmad-at-tayyar.html
342;"Risalah concernant l'éducation des enfants selon les préceptes de l'Islam, écrit par Nadjib Djélouah un cheikh algérien avec la préface de cheikh Ferkous.
Format moyen.
";https://www.sifatusafwa.com/fr/education/l-education-des-enfants-cheikh-abd-ar-razzaq-al-badr.html
343;"Il s'agit d'une encyclopédie complète dans l'éducation islamique pour les enfants, à partir du stade du mariage car l'harmonie entre les époux est une base solide pour élever correctement un enfant.Le nouvel aspect de ce livre est qu'il attire l'attention sur l'existence d'une approche éducative intégrée pour élever des enfants, tirée des conseils du Prophète, que la paix et les bénédictions d'Allah soient sur lui, et sa Sunna purifiée, en plus du contenu exceptionnel, bien organisé et avec des preuves claires de certains hadiths.C'est un best-seller dans son domaine, et cette édition 2019 est la 17ème réimpression de cet excellent livre.
";https://www.sifatusafwa.com/fr/education/manhaj-at-tarbiyyah-an-nabawiyyah-li-at-tifl-éducation-prophétique.html
344;"Conférence très intéressante du Cheikh Salih al-Fawzan dans laquelle il donne de nombreuses orientations pour les jeunes dans plusieurs domaines qui les intéressent et leur seront utiles. Suivi de 24 questions-réponses.
Édition moyen format (12x17cm), impression en noir et rouge sur papier beige.
";https://www.sifatusafwa.com/fr/education/tawjihat-muhimmah-li-chabab-al-oummah-cheikh-al-fawzan.html
345;"Réfutation de Cheikh Salih Al Ach-Cheikh du livre ""Mafahim yajib 'an Tusahhah"" de Muhammad ibn 'Alawy qui traite du Tawhid, du Takfir, et surtout du Tawassoul et du Tabarrouk. Shaykh Salih Al-Shaykh le réfute en argumentant  et en exposant la réalité de ces sujets selon la Aqida Salafiyyah.
";https://www.sifatusafwa.com/fr/egarements-et-ambiguites/hadhihi-mafahimouna-rad-de-salih-aal-shaykh-à-muhammad-ibn-alawy-al-maliky.html
346;"Deux Risalah :
La première est issue des écrits de Ibn Taymiyyah, sur l'Union des musulmans, l'interdiction des divisions vaines, du Takfir du pécheur, le danger de la dissolution de l’unité des musulmans.
La seconde est une épitre de Ibn Hazm qui répond à une personne l’interrogeant sur la permission de prier derrière un Imam suivant un autre madhhad, il explique donc que la divergence est permise et qu'elle ne peut être source de division entre les musulmans.
Vérifiées, préparées et annotées par le Muhaqqiq Abdul-Fattah Abou Ghouddah.
";https://www.sifatusafwa.com/fr/egarements-et-ambiguites/l-union-des-musulmans-ibn-taymia-suivi-de-l-imamah-ibn-hazm.html
347;"Un des plus beaux recueils de Hadith et Athar qui soit, et qui est pourtant rare. Il s'agit d'un recueil attribué à l'Imam Ibn Hajar al-Asqalani qui regroupe des conseils et avertissements selon les nombres. Comme le type de conseils ou de rappels qui consiste à dire : ""Trois choses durcissent le coeur..."" ou encore ""10 choses celui qui y croit..."" Ainsi il y a les chapitres des 2 choses, des 3 et ainsi de suite.Chaque Athar ou Hadith est ultra riche d'enseignement. Le texte est publié avec l'explication du Cheikh Muhammad ibn Umar al-Jawi, un savant du siècle dernier.100% harakat sur le texte de Ibn Hajar, très belle édition Turque vérifiée, avec le référencement de chaque Athar entre crochets dans le Charh.
";https://www.sifatusafwa.com/fr/entre-75-et-100-harakat/munabbihat-ala-isti-dad-li-yam-al-ma-ad-ibn-hajar-citations-de-salafs.html
348;"Explication du recueil des 40 Hadiths de l'Imam an-Nawawi, par le savant Abdallah ibn Jibrin.
Très belle édition saoudienne autorisée.
";https://www.sifatusafwa.com/fr/explications-de-hadith-choisi/charh-arba-in-an-nawawiyyah-lil-imam-an-nawawi-al-jibrin.html
349;"« Charh Ma’ani al-Athar » est un livre sur les hadiths de Fiqh et les preuves de questions de jurisprudence sur lesquelles il y a eu divergence, classé selon les chapitres du Fiqh.
Son auteur, l'Imam Abu Ja’far at-Tahawi y a mentionné les hadiths rapportés du Messager d’ALLAH -paix et bénédictions sur lui- dans le Fiqh, dont on pourrait croire qu’ils se contredisent, en clarifiant l’abrogeant de l’abrogé, le restreint de l’absolu et celui qu’on applique de celui que l’on n’applique pas.
« Charh Ma’ani al-Athar » fait partie des recueils fiables du noble hadith prophétique, et il a été considéré par al-Hafiz Ibn Hajar dans son livre « Ithaf al-Mahra » comme l'un des recueils de hadiths qui suivent les « six livres » en terme de hadiths authentiques.
Ce livre renferme des informations bénéfiques concernant les textes des hadiths et leurs chaines de transmission, clarifiant les déductions et les contradictions, distinguant l’abrogeant de l’abrogé et mentionnant les paroles des savants du Jarh wa Ta'dil (la critique et l’éloge) qui aident à accepter ou refuser les hadiths, sans oublier l’ordre excellent de ses chapitres.
La valeur de ce livre se manifeste par l'intérêt que les savants lui ont porté, anciens comme contemporains, en l’expliquant, en le résumant, en référençant ses hadiths, en faisant la biographie de ses rapporteurs et en extrayant ses hadiths qui ne se trouvent pas dans les « six livres ».
Très bonne édition, vérifiée à partir de 13 manuscrits écrits et à partir du livre Nukha al-Afkar de l'imam al-'Ayni.
";https://www.sifatusafwa.com/fr/explications-de-hadith-choisi/charh-ma-ani-al-athar-de-l-imam-at-tahawi.html
350;"Explication des Hadiths authentiques du livre Adab al-Moufrad d’Al-Boukhari. 
Cette sélection de Hadith est celle du Cheikh Al-Albani dans son travail de Sahih wa Da’if al-Adab al-Mufrad.
Le commentaire est l’œuvre d’un de ses élèves, le Dr Houssain al-’Awaychah.
Très belle édition en 3 volumes, avec toutes les Harakats sur les Hadiths, et les Harakats en partie sur le reste du texte.
";https://www.sifatusafwa.com/fr/explications-de-hadith-choisi/charh-sahih-adab-al-mufrad-lil-imam-al-bukhari-husayn-al-awayshah.html
351;"Livre de l'Imam at-Tabarani (360H) grand Imam du Hadith, concernant le célèbre Hadith ""Celui qui ment sur moi volontairement..."" et ses différentes sources et versions. Vérifié et annoté par Ali Hassan AbdelHamid.
Ancienne édition (1990), livre rare.
";https://www.sifatusafwa.com/fr/explications-de-hadith-choisi/concernant-le-hadith-celui-qui-ment-sur-moi-at-tabarani.html
352;"Excellent ouvrage qui rassemble des centaines de Fawaid issues de l'immense ouvrage Fath al-Bari, l'explication de Sahih al-Boukhari par l'Imam Ibn Hajar al-Asqalani.
Très bien structuré, l'auteur prend soin de citer chaque fois le chapitre et le hadith avant de rassembler les perles parmi les paroles d'Ibn Hajar. Les Fawaid sont très nombreuses et concernent toutes les sciences islamiques, et ce très large volume permettra au lecteur de gouter au savoir que recèle cet immense livre qu'est Fath al-Bari.
";https://www.sifatusafwa.com/fr/explications-de-hadith-choisi/fawaid-ibn-hajar-al-asqalani-min-fath-al-bari-900-pages.html
353;"Ce livre explore les meilleurs des caractères, en prenant pour cela 50 Hadith prophétiques. L’auteur effectue une explication simple et réfléchie, afin de toucher le lecteur et l’amener à une introspection salutaire.
** Ce livre est un best-seller dans la péninsule Arabique **
L’auteur est connu pour son style littéraire, bien écrit et accessible à tous, qui a sut changer la vie de milliers de lecteurs à travers ses différents ouvrages.
Très belle édition en couleur (impression en noir et bleu sur papier recyclé), avec 100% des harakats sur les Hadiths.
";https://www.sifatusafwa.com/fr/explications-de-hadith-choisi/hilyah-al-waqar-li-jil-itrouh-al-adab-ali-ben-jabir-al-fayfi.html
354;"Explication du Cheikh Salih al-Osaymi au meilleur livre écrit sur le Tawhid al-'Ubudiyyah, Kitab at-Tawhid de Muhammad ibn Abdelwahhab.
Harakat en partie (50%).
";https://www.sifatusafwa.com/fr/explications-de-kitab-at-tawhid/charh-kitab-at-tawhid-salih-al-osaimi.html
355;"Explication de Kitab at-Tawhid de Muhammad ibn Abdelwahhab par le grand savant Marocain pluridisciplinaire, le Cheikh Mohammed Taqi ed-Din al-Hilali.
L'ouvrage est vérifié par le Cheikh Mashhour Hasan Al-Salman.
";https://www.sifatusafwa.com/fr/explications-de-kitab-at-tawhid/charh-kitab-at-tawhid-taqi-ad-din-al-hilali.html
356;"Explication du Cheikh Abd el-Karim al-Khoudayr du célèbre Kitab at-Tawhid de Muhammad ibn Abdelwahhab.
Superbe édition Saoudienne avec quelques Harakats en 2 volumes.
";https://www.sifatusafwa.com/fr/explications-de-kitab-at-tawhid/hiliyah-al-moustafid-charh-kitab-at-tawhid-abdelkarim-al-khoudayr.html
357;"Recueil de 4 explications faites par le Cheikh AbdelAziz ibn Baz sur 4 Risalah de Cheikh al-Islam ibn Taymiyyah:
Al-Aqidah al-Wasitiyyah
Al-Risalah al-Hamawiyyah
Iqtida Sirat al-Mustaqim
Kitab al-Istiqamah
Belle édition, avec Harakat sur les Matn, et authentification des Hadith selon les avis de Cheikh al-Albani.
";https://www.sifatusafwa.com/fr/explications-de-livres-de-aqida/4-explications-de-cheikh-ibn-baz-at-ta-liqat-al-baziyah-2-volumes.html
358;"Cet ouvrage du Cheikh Abdelaziz ar-Rajihi explique le Risalah Nawah al-Iman du Cheikh Abdel-Latif ibn Abderrahman Aal Cheikh, une épître dans le Tawhid de l’adoration (Tawhid al-Oulouwiya), et malgré sa petite taille cette épître concise est précieuse, bénéfique et complète concernant le chapitre du Tawhid.
Très belle édition saoudienne, format moyen (14x20cm) et couverture semi-rigide.
";https://www.sifatusafwa.com/fr/explications-de-livres-de-aqida/al-bayan-li-risalah-nuwah-al-iman-by-abdellatif-al-cheikh-ar-rajihi.html
359;" 
";https://www.sifatusafwa.com/fr/explications-de-livres-de-aqida/al-maghribiyyah-charh-al-aqidah-al-qayrawaniyyah-abdul-aziz-at-tarifi.html
360;"L'explication du célèbre ouvrage de ibn Taymiya, Iqtidaae as-Siraat al-Mustaqim Mukhaalafat AsHaab al-Jahim.
L'explication de cheikh Salih al-Fawzan est présentée dans cette très belle édition autorisée en 5 volumes, avec référencement des hadiths.
";https://www.sifatusafwa.com/fr/explications-de-livres-de-aqida/at-ta-liq-al-qawim-ala-kitab-iqtida-sirat-al-mustaqim-al-fawzan.html
361;"Explication du Cheikh Abdelkarim al-Khoudayr de la Aqidah al-Wassitiya de l'imam Ibn Taymiyyah.
Magnifique édition saoudienne, harakat en partie.
";https://www.sifatusafwa.com/fr/explications-de-livres-de-aqida/at-ta-liqat-as-saniyyah-ala-al-aqidah-al-wassitiyyah-abdelkarim-al-khoudayr.html
362;"Explication de la célèbre Aqidah al-Wassitiyyah de Cheikh al-Islam ibn Taymiyyah, par le savant Abdallah ibn Jibrin.
Très belle édition saoudienne autorisée.
";https://www.sifatusafwa.com/fr/explications-de-livres-de-aqida/at-ta-liqat-az-zakiyyah-ala-al-aqidah-al-wasitiyyah-al-jibrin.html
363;"L'explication par cheikh AbdelAziz ar-Rajihi de la risala de l'Imam al-Barbahari intitulée Charh as-Sounnah, qui est un traité de Aqidah de Ahl as-Sounnah wa al-Jama'ah.Édition officielle saoudienne.
";https://www.sifatusafwa.com/fr/explications-de-livres-de-aqida/awn-al-qari-bi-ta-liq-ala-sharh-as-sunnah-lil-barbahari-ar-rajihi.html
364;"Explication du poème al-Haiyah du Hafidh Ibn Abi Dawud as-Sijistani, par le savant Abdallah ibn Jibrin.
Très belle édition saoudienne autorisée.
";https://www.sifatusafwa.com/fr/explications-de-livres-de-aqida/charh-al-haa-iyyah-poème-d-ibn-abi-dawoud-al-jibrin.html
365;"Explication du poème al-Lamiyah du Cheikh al-Islam ibn Taymiyyah, par le savant Abdallah ibn Jibrin.
Très belle édition saoudienne autorisée.
";https://www.sifatusafwa.com/fr/explications-de-livres-de-aqida/charh-al-laamiyyah-poème-d-ibn-taymiyyah-al-jibrin.html
366;"Explication bénéfique du poème en Lam de Cheikh al-Islam ibn Taymiyyah dans lequel il expose sa Aqida.
Ce Charh est bien structuré et très intéressant. Très belle édition.
";https://www.sifatusafwa.com/fr/explications-de-livres-de-aqida/charh-al-lamiyah-de-ibn-taymiyyah-yusuf-ibn-abdallah-as-salam.html
367;"Il s'agit de l'explication de Cheikh Raslan de l’œuvre du grand savant Hafidh Hakami, 'Alaam as-Sounnah al-Manchourah, aussi appelé 200 questions-réponses dans la Aqida.
Magnifique édition en 2 volumes, 100% Harakat.
";https://www.sifatusafwa.com/fr/explications-de-livres-de-aqida/charh-alam-as-sounnah-al-manchourah-d-al-hakami-cheikh-raslan-2-vol.html
368;"Explication du poème at-Taiyah de Cheikh al-Islam ibn Taymiyyah, par le savant Abdallah ibn Jibrin.
Très belle édition saoudienne autorisée.
";https://www.sifatusafwa.com/fr/explications-de-livres-de-aqida/charh-at-taa-iyyah-poem-of-ibn-taymiyyah-al-jibrin.html
369;"Voici l’explication de la Risalah de l’Imam Abu Bakr al-Isma’ili (371H) avec le commentaire éclairé et efficace du Cheikh Abdullah al-Ghunayman, qui figure parmi les ulémas enseignants au Masjid an-Nabawi.
Très belle édition saoudienne.
";https://www.sifatusafwa.com/fr/explications-de-livres-de-aqida/charh-i-tiqad-ahl-as-sounnah-cheikh-abdallah-al-ghounayman.html
370;"Explication d'une perle parmi les Risalah sur le Tawhid, le livre Tajrid at-Tawhid al-Moufid de l'Imam al-Maqrizi (853H), par le noble cheikh Salih al-Fawzan.
";https://www.sifatusafwa.com/fr/explications-de-livres-de-aqida/charh-tajrid-at-tawhid-al-mufid-d-al-maqrizi-cheikh-al-fawzan.html#/33-edition-édition_1
371;"Explication d'une perle parmi les Risalah sur le Tawhid, le livre Tajrid at-Tawhid al-Moufid de l'Imam al-Maqrizi (853H), par le noble cheikh Salih al-Fawzan.
";https://www.sifatusafwa.com/fr/explications-de-livres-de-aqida/charh-tajrid-at-tawhid-al-mufid-d-al-maqrizi-cheikh-al-fawzan.html#/34-edition-édition_2
